{
    "tables": {
        "Orders_ECFCA1FB690A41FE803BC071773BA862": {
            "columns": [
                "Order ID",
                "Order Date",
                "Ship Date",
                "Ship Mode",
                "Customer Name",
                "Segment",
                "Country/Region",
                "City",
                "State",
                "Postal Code",
                "Region",
                "Category",
                "Sub-Category",
                "Product Name",
                "Sales",
                "Quantity",
                "Discount",
                "Profit"
            ],
            "type": "fact",
            "source": "tableau_hyper"
        },
        "Returns_2AA0FE4D737A4F63970131D0E7480A03": {
            "columns": [
                "Returned",
                "Order ID"
            ],
            "type": "dimension",
            "source": "tableau_hyper"
        },
        "People_D73023733B004CC1B3CB1ACF62F4A965": {
            "columns": [
                "Regional Manager",
                "Region"
            ],
            "type": "dimension",
            "source": "tableau_hyper"
        }
    },
    "measures": {
        "[Parameter 1]": {
            "ast": {
                "node": "constant",
                "dtype": "number",
                "value": 2022
            },
            "formula": "2022",
            "source": "tableau"
        },
        "[Parameter 2]": {
            "ast": {
                "node": "constant",
                "dtype": "string",
                "value": "Pradeep Kumar G"
            },
            "formula": "\"Pradeep Kumar G\"",
            "source": "tableau"
        },
        "[% Diff Shape (copy)]": {
            "ast": {
                "node": "conditional",
                "branches": [
                    {
                        "when": {
                            "node": "comparison",
                            "op": ">",
                            "left": {
                                "node": "field",
                                "name": "Calculation_1069041984833634338",
                                "table": null
                            },
                            "right": {
                                "node": "constant",
                                "dtype": "number",
                                "value": 0
                            }
                        },
                        "then": {
                            "node": "constant",
                            "dtype": "string",
                            "value": "Positive"
                        }
                    },
                    {
                        "when": {
                            "node": "comparison",
                            "op": "<",
                            "left": {
                                "node": "field",
                                "name": "Calculation_1069041984833634338",
                                "table": null
                            },
                            "right": {
                                "node": "constant",
                                "dtype": "number",
                                "value": 0
                            }
                        },
                        "then": {
                            "node": "constant",
                            "dtype": "string",
                            "value": "Negative"
                        }
                    }
                ],
                "otherwise": {
                    "node": "constant",
                    "dtype": "string",
                    "value": "No Change"
                }
            },
            "formula": "if [Calculation_1069041984833634338]>0 then \"Positive\" \r\nELSEIF[Calculation_1069041984833634338]<0 then \"Negative\" \r\nelse \"No Change\" end",
            "source": "tableau"
        },
        "[Calculation_1054123792576798720]": {
            "ast": {
                "node": "conditional",
                "branches": [
                    {
                        "when": {
                            "node": "comparison",
                            "op": "=",
                            "left": {
                                "node": "aggregation",
                                "agg": "COUNTD",
                                "arg": {
                                    "node": "field",
                                    "name": "Calculation_870883616948187188",
                                    "table": null
                                }
                            },
                            "right": {
                                "node": "constant",
                                "dtype": "number",
                                "value": 1
                            }
                        },
                        "then": {
                            "node": "aggregation",
                            "agg": "ATTR",
                            "arg": {
                                "node": "function",
                                "name": "STR",
                                "args": [
                                    {
                                        "node": "function",
                                        "name": "YEAR",
                                        "args": [
                                            {
                                                "node": "field",
                                                "name": "Order Date",
                                                "table": "Orders_ECFCA1FB690A41FE803BC071773BA862"
                                            }
                                        ]
                                    }
                                ]
                            }
                        }
                    }
                ],
                "otherwise": {
                    "node": "binary",
                    "op": "+",
                    "left": {
                        "node": "binary",
                        "op": "+",
                        "left": {
                            "node": "function",
                            "name": "STR",
                            "args": [
                                {
                                    "node": "aggregation",
                                    "agg": "MIN",
                                    "arg": {
                                        "node": "function",
                                        "name": "YEAR",
                                        "args": [
                                            {
                                                "node": "field",
                                                "name": "Order Date",
                                                "table": "Orders_ECFCA1FB690A41FE803BC071773BA862"
                                            }
                                        ]
                                    }
                                }
                            ]
                        },
                        "right": {
                            "node": "constant",
                            "dtype": "string",
                            "value": " - "
                        }
                    },
                    "right": {
                        "node": "function",
                        "name": "STR",
                        "args": [
                            {
                                "node": "aggregation",
                                "agg": "MAX",
                                "arg": {
                                    "node": "function",
                                    "name": "YEAR",
                                    "args": [
                                        {
                                            "node": "field",
                                            "name": "Order Date",
                                            "table": "Orders_ECFCA1FB690A41FE803BC071773BA862"
                                        }
                                    ]
                                }
                            }
                        ]
                    }
                }
            },
            "formula": "IF COUNTD([Calculation_870883616948187188])=1 THEN ATTR(STR(YEAR([Order Date])))\r\nELSE (STR(MIN(YEAR([Order Date])))+\" - \"+STR(MAX(YEAR([Order Date]))))\r\nEND",
            "source": "tableau"
        },
        "[Calculation_1069041984833634338]": {
            "ast": {
                "node": "binary",
                "op": "/",
                "left": {
                    "node": "aggregation",
                    "agg": "SUM",
                    "arg": {
                        "node": "binary",
                        "op": "-",
                        "left": {
                            "node": "function",
                            "name": "ZN",
                            "args": [
                                {
                                    "node": "conditional",
                                    "branches": [
                                        {
                                            "when": {
                                                "node": "comparison",
                                                "op": "=",
                                                "left": {
                                                    "node": "function",
                                                    "name": "YEAR",
                                                    "args": [
                                                        {
                                                            "node": "field",
                                                            "name": "Order Date",